No,Category,Guideline,Description,Do,Don't,Code Good,Code Bad,Severity,Docs URL
1,Widgets,Use StatelessWidget when possible,Immutable widgets are simpler,StatelessWidget for static UI,StatefulWidget for everything,class MyWidget extends StatelessWidget,class MyWidget extends StatefulWidget (static),Medium,https://api.flutter.dev/flutter/widgets/StatelessWidget-class.html
2,Widgets,Keep widgets small,Single responsibility principle,Extract widgets into smaller pieces,Large build methods,Column(children: [Header() Content()]),500+ line build method,Medium,
3,Widgets,Use const constructors,Compile-time constants for performance,const MyWidget() when possible,Non-const for static widgets,const Text('Hello'),Text('Hello') for literals,High,https://dart.dev/guides/language/language-tour#constant-constructors
4,Widgets,Prefer composition over inheritance,Combine widgets using children,Compose widgets,Extend widget classes,Container(child: MyContent()),class MyContainer extends Container,Medium,
5,State,Use setState correctly,Minimal state in StatefulWidget,setState for UI state changes,setState for business logic,setState(() { _counter++; }),Complex logic in setState,Medium,https://api.flutter.dev/flutter/widgets/State/setState.html
6,State,Avoid setState in build,Never call setState during build,setState in callbacks only,setState in build method,onPressed: () => setState(() {}),build() { setState(); },High,
7,State,Use state management for complex apps,Provider Riverpod BLoC,State management for shared state,setState for global state,Provider.of<MyState>(context),Global setState calls,Medium,
8,State,Prefer Riverpod or Provider,Recommended state solutions,Riverpod for new projects,InheritedWidget manually,ref.watch(myProvider),Custom InheritedWidget,Medium,https://riverpod.dev/
9,State,Dispose resources,Clean up controllers and subscriptions,dispose() for cleanup,Memory leaks from subscriptions,@override void dispose() { controller.dispose(); },No dispose implementation,High,
10,Layout,Use Column and Row,Basic layout widgets,Column Row for linear layouts,Stack for simple layouts,"Column(children: [Text(), Button()])",Stack for vertical list,Medium,https://api.flutter.dev/flutter/widgets/Column-class.html
11,Layout,Use Expanded and Flexible,Control flex behavior,Expanded to fill space,Fixed sizes in flex containers,Expanded(child: Container()),Container(width: 200) in Row,Medium,
12,Layout,Use SizedBox for spacing,Consistent spacing,SizedBox for gaps,Container for spacing only,SizedBox(height: 16),Container(height: 16),Low,
13,Layout,Use LayoutBuilder for responsive,Respond to constraints,LayoutBuilder for adaptive layouts,Fixed sizes for responsive,LayoutBuilder(builder: (context constraints) {}),Container(width: 375),Medium,https://api.flutter.dev/flutter/widgets/LayoutBuilder-class.html
14,Layout,Avoid deep nesting,Keep widget tree shallow,Extract deeply nested widgets,10+ levels of nesting,Extract widget to method or class,Column(Row(Column(Row(...)))),Medium,
15,Lists,Use ListView.builder,Lazy list building,ListView.builder for long lists,ListView with children for large lists,"ListView.builder(itemCount: 100, itemBuilder: ...)",ListView(children: items.map(...).toList()),High,https://api.flutter.dev/flutter/widgets/ListView-class.html
16,Lists,Provide itemExtent when known,Skip measurement,itemExtent for fixed height items,No itemExtent for uniform lists,ListView.builder(itemExtent: 50),ListView.builder without itemExtent,Medium,
17,Lists,Use keys for stateful items,Preserve widget state,Key for stateful list items,No key for dynamic lists,ListTile(key: ValueKey(item.id)),ListTile without key,High,
18,Lists,Use SliverList for custom scroll,Custom scroll effects,CustomScrollView with Slivers,Nested ListViews,CustomScrollView(slivers: [SliverList()]),ListView inside ListView,Medium,https://api.flutter.dev/flutter/widgets/SliverList-class.html
19,Navigation,Use Navigator 2.0 or GoRouter,Declarative routing,go_router for navigation,Navigator.push for complex apps,GoRouter(routes: [...]),Navigator.push everywhere,Medium,https://pub.dev/packages/go_router
20,Navigation,Use named routes,Organized navigation,Named routes for clarity,Anonymous routes,Navigator.pushNamed(context '/home'),Navigator.push(context MaterialPageRoute()),Low,
21,Navigation,Handle back button (PopScope),Android back behavior and predictive back (Android 14+),Use PopScope widget (WillPopScope is deprecated),Use WillPopScope,"PopScope(canPop: false, onPopInvoked: (didPop) => ...)",WillPopScope(onWillPop: ...),High,https://api.flutter.dev/flutter/widgets/PopScope-class.html
22,Navigation,Pass typed arguments,Type-safe route arguments,Typed route arguments,Dynamic arguments,MyRoute(id: '123'),arguments: {'id': '123'},Medium,
23,Async,Use FutureBuilder,Async UI building,FutureBuilder for async data,setState for async,FutureBuilder(future: fetchData()),fetchData().then((d) => setState()),Medium,https://api.flutter.dev/flutter/widgets/FutureBuilder-class.html
24,Async,Use StreamBuilder,Stream UI building,StreamBuilder for streams,Manual stream subscription,StreamBuilder(stream: myStream),stream.listen in initState,Medium,https://api.flutter.dev/flutter/widgets/StreamBuilder-class.html
25,Async,Handle loading and error states,Complete async UI states,ConnectionState checks,Only success state,if (snapshot.connectionState == ConnectionState.waiting),No loading indicator,High,
26,Async,Cancel subscriptions,Clean up stream subscriptions,Cancel in dispose,Memory leaks,subscription.cancel() in dispose,No subscription cleanup,High,
27,Theming,Use ThemeData,Consistent theming,ThemeData for app theme,Hardcoded colors,Theme.of(context).primaryColor,Color(0xFF123456) everywhere,Medium,https://api.flutter.dev/flutter/material/ThemeData-class.html
28,Theming,Use ColorScheme,Material 3 color system,ColorScheme for colors,Individual color properties,colorScheme: ColorScheme.fromSeed(),primaryColor: Colors.blue,Medium,
29,Theming,Access theme via context,Dynamic theme access,Theme.of(context),Static theme reference,Theme.of(context).textTheme.bodyLarge,TextStyle(fontSize: 16),Medium,
30,Theming,Support dark mode,Respect system theme,darkTheme in MaterialApp,Light theme only,"MaterialApp(theme: light, darkTheme: dark)",MaterialApp(theme: light),Medium,
31,Animation,Use implicit animations,Simple animations,AnimatedContainer AnimatedOpacity,Explicit for simple transitions,AnimatedContainer(duration: Duration()),AnimationController for fade,Low,https://api.flutter.dev/flutter/widgets/AnimatedContainer-class.html
32,Animation,Use AnimationController for complex,Fine-grained control,AnimationController with Ticker,Implicit for complex sequences,AnimationController(vsync: this),AnimatedContainer for staggered,Medium,
33,Animation,Dispose AnimationControllers,Clean up animation resources,dispose() for controllers,Memory leaks,controller.dispose() in dispose,No controller disposal,High,
34,Animation,Use Hero for transitions,Shared element transitions,Hero for navigation animations,Manual shared element,Hero(tag: 'image' child: Image()),Custom shared element animation,Low,https://api.flutter.dev/flutter/widgets/Hero-class.html
35,Forms,Use Form widget,Form validation,Form with GlobalKey,Individual validation,Form(key: _formKey child: ...),TextField without Form,Medium,https://api.flutter.dev/flutter/widgets/Form-class.html
36,Forms,Use TextEditingController,Control text input,Controller for text fields,onChanged for all text,final controller = TextEditingController(),onChanged: (v) => setState(),Medium,
37,Forms,Validate on submit,Form validation flow,_formKey.currentState!.validate(),Skip validation,if (_formKey.currentState!.validate()),Submit without validation,High,
38,Forms,Dispose controllers,Clean up text controllers,dispose() for controllers,Memory leaks,controller.dispose() in dispose,No controller disposal,High,
39,Performance,Use const widgets,Reduce rebuilds,const for static widgets,No const for literals,const Icon(Icons.add),Icon(Icons.add),High,
40,Performance,Avoid rebuilding entire tree,Minimal rebuild scope,Isolate changing widgets,setState on parent,Consumer only around changing widget,setState on root widget,High,
41,Performance,Use RepaintBoundary,Isolate repaints,RepaintBoundary for animations,Full screen repaints,RepaintBoundary(child: AnimatedWidget()),Animation without boundary,Medium,https://api.flutter.dev/flutter/widgets/RepaintBoundary-class.html
42,Performance,Profile with DevTools,Measure before optimizing,Flutter DevTools profiling,Guess at performance,DevTools performance tab,Optimize without measuring,Medium,https://docs.flutter.dev/tools/devtools
43,Accessibility,Use Semantics widget,Screen reader support,Semantics for accessibility,Missing accessibility info,Semantics(label: 'Submit button'),GestureDetector without semantics,High,https://api.flutter.dev/flutter/widgets/Semantics-class.html
44,Accessibility,Support large fonts,MediaQuery text scaling,MediaQuery.textScaleFactor,Fixed font sizes,style: Theme.of(context).textTheme,TextStyle(fontSize: 14),High,
45,Accessibility,Test with screen readers,TalkBack and VoiceOver,Test accessibility regularly,Skip accessibility testing,Regular TalkBack testing,No screen reader testing,High,
46,Testing,Use widget tests,Test widget behavior,WidgetTester for UI tests,Unit tests only,testWidgets('...' (tester) async {}),Only test() for UI,Medium,https://docs.flutter.dev/testing
47,Testing,Use integration tests,Full app testing,integration_test package,Manual testing only,IntegrationTestWidgetsFlutterBinding,Manual E2E testing,Medium,
48,Testing,Mock dependencies,Isolate tests,Mockito or mocktail,Real dependencies in tests,when(mock.method()).thenReturn(),Real API calls in tests,Medium,
49,Platform,Use Platform checks,Platform-specific code,Platform.isIOS Platform.isAndroid,Same code for all platforms,if (Platform.isIOS) {},Hardcoded iOS behavior,Medium,
50,Platform,Use kIsWeb for web,Web platform detection,kIsWeb for web checks,Platform for web,if (kIsWeb) {},Platform.isWeb (doesn't exist),Medium,
51,Packages,Use pub.dev packages,Community packages,Popular maintained packages,Custom implementations,cached_network_image,Custom image cache,Medium,https://pub.dev/
52,Packages,Check package quality,Quality before adding,Pub points and popularity,Any package without review,100+ pub points,Unmaintained packages,Medium,
53,Dart 3.x,Use records for data tuples,Dart 3.0 records for immutable lightweight data,Use records for simple data grouping,Create full classes for simple tuples,"final (name, age) = ('John', 30); typedef User = (String name, int age);","class SimpleData { String a; int b; } // for tuples",Medium,https://dart.dev/language/records
54,Dart 3.x,Use sealed classes for state,Sealed classes enable exhaustive pattern matching,sealed class for finite state hierarchies,Open inheritance for known states,"sealed class Result {} class Success extends Result { final String data; } switch (result) { Success() => ... }","abstract class Result {} // not exhaustive",High,https://dart.dev/language/class-modifiers#sealed
55,Dart 3.x,Use switch expressions,Dart 3.0 pattern matching for concise logic,Switch expressions for conditional returns,Nested if-else chains,"final status = switch (code) { 200 => 'OK', 404 => 'Not Found', _ => 'Error' };","if (code == 200) return 'OK'; else if ...",Medium,https://dart.dev/language/patterns
56,State,Use Riverpod code generation,@riverpod annotation reduces boilerplate,@riverpod with build_runner for providers,Manual provider declarations in large apps,"@riverpod Future<User> user(UserRef ref) async { return await fetchUser(); }","final userProvider = FutureProvider((ref) => fetchUser());",High,https://riverpod.dev/docs/concepts/about_code_generation
57,State,Consider flutter_hooks,Hooks pattern for cleaner StatefulWidget logic,useAnimationController useTextEditingController,Repeated dispose boilerplate,"final controller = useTextEditingController(); final animation = useAnimationController(duration: Duration(seconds: 1));","late TextEditingController c; initState dispose",Medium,https://pub.dev/packages/flutter_hooks
58,Performance,Leverage Impeller renderer,New graphics engine for consistent 120fps,Impeller for modern iOS/Android (default 3.16+),Skia-only assumptions on new devices,"// Enabled by default in Flutter 3.16+ // Precompiled shaders eliminate jank","// Skia shader compilation jank on first run",High,https://docs.flutter.dev/perf/impeller
59,UI,Use Material 3 components,M3 design system with dynamic theming,useMaterial3: true with M3 widgets,Material 2 patterns in new projects,"MaterialApp(theme: ThemeData(useMaterial3: true, colorScheme: ColorScheme.fromSeed(seedColor: Colors.blue)))","ThemeData(primarySwatch: Colors.blue) // M2",High,https://docs.flutter.dev/ui/design/material
60,UI,Use Slivers for scroll effects,CustomScrollView with Slivers for complex scrolling,SliverAppBar SliverList SliverGrid,Nested ListView or SingleChildScrollView,"CustomScrollView(slivers: [SliverAppBar.large(), SliverList.builder(itemBuilder: ...)])","ListView(children: [AppBar(), ListView()]) // nested",High,https://api.flutter.dev/flutter/widgets/CustomScrollView-class.html
61,Navigation,Use auto_route for complex apps,Type-safe code-generated routing,auto_route with @RoutePage annotations,Manual route management in large apps,"@RoutePage() class HomeScreen extends StatelessWidget {} // auto_route","Navigator.push(context, MaterialPageRoute(builder: ...)) everywhere",Medium,https://pub.dev/packages/auto_route
62,Navigation,Handle predictive back gesture,Android 14+ predictive back support,PopScope with onPopInvokedWithResult,Ignore predictive back on Android 14+,"PopScope(canPop: false, onPopInvokedWithResult: (didPop, result) { if (!didPop) handleBack(); })","WillPopScope(onWillPop: ...) // deprecated",High,https://developer.android.com/guide/navigation/custom-back/predictive-back-gesture
63,Platform,Optimize for Flutter Web,Web-specific patterns and lazy loading,kIsWeb checks and deferred imports,Assume mobile patterns work on web,"if (kIsWeb) { // web-specific } import 'heavy.dart' deferred as heavy;","// Same code for mobile and web without checks",Medium,https://docs.flutter.dev/platform-integration/web
64,Platform,Support desktop form factors,Keyboard shortcuts hover states scroll physics,Shortcuts Actions FocusNode for desktop,Touch-only patterns on desktop,"Shortcuts(shortcuts: {LogicalKeySet(LogicalKeyboardKey.escape): DismissIntent()}, child: Actions(...))","// No keyboard navigation support",Medium,https://docs.flutter.dev/platform-integration/desktop
65,Animation,Use flutter_animate package,Declarative animation composition,Chained animate methods for sequences,Complex AnimationController for simple sequences,"widget.animate().fadeIn(duration: 300.ms).slideX(begin: -0.1)","AnimationController + Tween + AnimatedBuilder // for fade+slide",Low,https://pub.dev/packages/flutter_animate
66,Testing,Use golden tests for visual regression,Pixel-perfect screenshot testing,matchesGoldenFile for critical UI,Skip visual regression testing,"await expectLater(find.byType(MyWidget), matchesGoldenFile('goldens/my_widget.png'));","// No visual testing",Medium,https://api.flutter.dev/flutter/flutter_test/matchesGoldenFile.html
67,Testing,Use patrol for integration tests,Better integration test framework,Patrol for native interaction testing,Basic integration_test only for complex apps,"await $.native.tap('Allow'); await $(#loginButton).tap();","// Cannot interact with native dialogs",Medium,https://pub.dev/packages/patrol
68,Architecture,Use feature-first folder structure,Organize by feature not layer,/features/auth/ /features/home/ structure,Layer-first /screens/ /widgets/ /services/,"lib/features/auth/(data/domain/presentation) lib/features/home/...","lib/screens/ lib/widgets/ lib/services/ // hard to scale",Medium,https://docs.flutter.dev/app-architecture
69,Architecture,Apply clean architecture,Separation of data domain presentation layers,Repository pattern with dependency injection,Business logic in widgets,"class UserRepository { Future<User> getUser(); } // injected via Riverpod","// API calls directly in widgets",High,https://docs.flutter.dev/app-architecture/design-patterns
70,UI,Use SelectableRegion for text selection,Native text selection across widgets,SelectableRegion for selectable content,Custom selection implementations,"SelectableRegion(selectionControls: materialTextSelectionControls, child: Column(...))","// Custom gesture detector for selection",Low,https://api.flutter.dev/flutter/widgets/SelectableRegion-class.html
